Post ID,Type,Body Text
ixp2s8,Reply (Depth 4),"I actually found out about printful when I was using weebly as a portfolio website and it was...ok. The set up is a bit confusing but if you follow their online videos you'll be able to work it out. 

I ended up integrating it into a gumroad shop and so far so good! https://gumroad.com/ericapaints Basically printful does the printing and shipping for me and keeps all of my branding on it. It costs about $7 for an 8""x10"" plus a $5 shipping cost so it isn't amazing or anything but much better than redbubble. If things sell well then I know to take it down off of printful to make my own set of prints."
ixp2s8,Reply (Depth 5),thanks for the info!
ixp2s8,Reply (Depth 1),"Prints are the best revenue source, - i'm trying to start a print shop for the same reason.

Non-artists really don't understand, and as an artist I know that art is just luxury. It's definitely not something anyone needs to have immediately, but they get it because they want it. It's funny how I still can consider how people feel about art from the other side - it's 'drawing', and drawing sounds so basic, which is why you get all these people who complain about art being too expensive too. They WANT it, but somehow it's still TOO EASY to do and their 'cousin up the road' can do it BETTER and for less. 

We really are working on the side of luxury goods, and luxury goods ALWAYS have critics."
ixp2s8,Reply (Depth 1),"I find prints tricky - if you can only sell a handful, then the overhead costs are high. You would have to ask $20 bucks for a print ... and if the buyers were so far barely willing to pay this for an original, they'll buck at paying that for a copy.

Once you can sell hundreds or so, the printing costs get very low - and it's economical."
ixp2s8,Reply (Depth 2),"Would they though? Even if you do a short run of prints like 10  
You can still get it to $2.75 with a plastic sleeve and cardboard and mailer per print Plus what like ~$3 in the US for shipping. That's time much better spent making prints than making originals. That's roughly a $142.50 profit if you can sell all 10 just at $20. 

( I use pirateship for getting good shipping prices. - not sponsored, I just love them. )"
ixp2s8,Reply (Depth 3),"What is your example size? A postcard? Letter size? Are people willing to pay 20 bucks for that? I specifically wrote that the problem is that you won't find many buyers if you already didn't have 1 buying the original at the same price. 

Add in the costs of work for getting those clients and ordering and mailing, and it's more hassle than profit."
ixp2s8,Reply (Depth 3),I'd love to make prints but wouldn't know where to begin.
ixp2s8,Reply (Depth 4),"1.  Have art people want to buy.

1. Get buyers or put your artwork in a situation where people can see and buy it. (can do a pre-sale if you're worried about spending money)

3. Make the prints via a local print shop with a GOOD CLEAN scan or file. Google around to see where they are. Generally the same people who print flyers for companies and invites for parties will have a machine suitable. There are artists and print shops who do the same thing online. https://www.sixthleafclover.com/print.html and https://www.catprint.com/ are just a few. 

4. Decide how fancy you want to be while mailing and get supplies for that. The bare minimum would be rolls with some form of water proofing to protect the print while shipping.  

5. Write a little nice note or throw in a business card

6. ????

7. Profit"
ixp2s8,Reply (Depth 1),"Prints are an excellent solution to a problem like that, for sure. Totally agree. 

I've had people want to buy an original painting and get shocked that its going to cost them a few hundred bucks. Then I offer quality print options and they become excited again. The originals don't sell as often as the prints but they do sell."
ixp2s8,Reply (Depth 0),"Might be news but the human race doesn't have a hive-mind or collective consciousness, there are individual people expressing their thoughts and opinions. If one person says X, and another person says Y, there's no contradiction in the sense you're talking about it.

Artists will usually tell other artists to price up their work, and the average person prefers to buy cheap art. If there was nothing to buy under $20, they would still buy art, that's the idea behind what the artists say. On the other hand, sometimes you have to accept whatever you're offered, even if your work is worth 5-10 times that. This is a complex question.

Also, what the fuck is your problem?"
ixp2s8,Reply (Depth 1),"While writing this post, I thought there might be contradictions, but I posted it anyway lol

my 'problem' has an obvious answer which is literally 'people don't wanna buy expensive stuff', and I knew that already

but I still felt free to rant about it."
ixp2s8,Reply (Depth 2),"Fair enough. Yeah selling your stuff for a fair price is a difficult task at hand. 

I was offered an already problematic job (realizing someone else's design) this month and after their first offer I got literally and openly laughed at when I stated what I'd consider a fair price. First they started at 20% of what I had in mind and when I shared it then they told me that the maximum is 30% of that. So then I declined. On the other hand, on a meeting last week I stated my price and the reaction was ""um, ok, maybe we'll stretch the project through the next year then"" ... 

Point is, some people are willing or able to pay well/fairly, some aren't. Your job as an artist, like it or not, is to find the people who are. It's very annoying because that's not what we signed up for, but realizing this is what turns you from an amateur into a professional. And being actually able to do it turns you from being a starving artist into a successful artist.

So, for your own mental health, try to focus as little as possible on people who don't have the budget to pay you, they are wasted time and energy, and instead try to reach people who are worth your time. That second story's client I met directly through a previous client who I worked for, for 200% of the money I said would be fair to the person in the first story."
ixp2s8,Reply (Depth 3),"That's very true, THANK YOU for sharing ;;;

It really is what you accept as payment as an artist - and you're right, we really are starving artists until we accept proper payment for our work. 

I post mainly because I want to rant, but I know that me putting my opinion out there will either give way to refuting opinions or people that agree, and either is good  to create a healthy discourse so I can understand my own opinion better by reacting to others. It's also super interesting LOLOL - so thank YOU for going so in-depth about your version of events.

Imo I don't focus on people who don't have the budget, I just try to make my work reach as many people as possible and see if it sticks. I have one consistent customer, who are also trying to make it big in a similar industry - so they pay me what they can, but also try to price it fairly because we both understand eachother (which I think is beautiful LOLOL, but that's removed from the business aspect). 

I've NEVER accepted a commission that I don't think sounds fair - and even now, it's just down to how I feel about the price. Even without calculating costs myself\*, it's down to if I feel comfortable spending that time on a piece that might or might not be fairly compensated, like e.g. doing it for a customer you like but you KNOW can't afford it etc. (maybe you know them personally and it's a one off).

I tend to look at other artists ' at my level ' and see how much they charge, but then again they could ALSO be underpricing, and my work is more illustrative than fine art (and the prints aren't large) so I probably wouldn't charge as much for my work. My dream is to do freelance and start working with companies for design projects (which I'm guessing is what you're doing haha).

\*( I mentioned this in another post, but about how the skill x materials x time model is complicated because practicing efficiency and finishing the work quicker because you've built up enough skill to paint/create more accurately and precisely, shouldn't necessarily mean the work is cheaper - because it means you're penalised for being efficient)"
ixp2s8,Reply (Depth 4),"I don't want to get too much into it because it gets arrogant and boastful very quickly, but my prices aren't based on anything, I just want as much as I can get, because I worked for about 2 decades now to be where I am, and personally I feel like I'm still nowhere near to be payed *well*, considering everything. 

And this is what motivates me. Not the money, but the dissatisfaction about the gap between what I think I'm worth and what I'm actually able to get. (This is just as much about, say, invitations to mural festivals as being payed well.) 

Truth is that I'm always one step ahead of myself in this sense, and trying to close this gap and immediately opening a new one is my process of growing and evolving into being a bigger artist."
