Post ID,Type,Body Text
ixp2s8,Main Post,"It's always 'YOU SHOULD CHARGE MORE' if it's like $20 and above and there are 0 buyers

But when it's under, it's never CHARGE MORE

It's THANK YOU FOR UNDERVALUING YOUR ART SO I CAN BUY IT

It's kind of bitchy to undervalue someone's work because you want it for that price, and then turn around and tell other people to price up because their work is 'too good'. 

So only when it suits you, right?"
ixp2s8,Reply (Depth 0),"Okay, while I agree that artists should charge way more than $20, there are a few conditions to actually raise your price. First and foremost, when you start monetising your artwork, you become a business. That means you gotta know your product, your audience, and the value that you can bring to that audience. Are your works good enough/valuable? Note that sometimes it's not only about skill/technique. If you can make something that relates to your audience a lot, they'll buy it. Or at least, they'll share it so it might reach people that will buy it.   


You also got to know your audience. early 20s or below usually doesn't have hundreds of $ to spend on art. So it's either you shift to mature audience that can actually afford it(but that means you gotta level up your work a lot to compete with other professional artists), or you think of a way/strategy that still affordable yet able to give you profit. Other people says prints(or any small merch for that matter), and that's good, especially if you have a fanbase.  Tiktok art video maybe? Youtube?  


Last thing. This might be because I'm growing old and grumpy. Why y'all young artists rush to sell your artwork just after one or two people says ""oh I like your work, you should sell it""? That will just add so much unnecessary pressure when you should focus on studying and improving your artwork. If you need money, take part time jobs. When your works improved and become valuable, people will notice you. Then you can take some commissions and raise your price whenever you got overbooked"
ixp2s8,Reply (Depth 0),"step one : find a way to mass product your art for cheap, so you can still sell each product for $20-30 a pop. my original ink pieces are priced around $60 at the moment but they were originally prices at $20 when i had no buyers.

step two: do actual promo events for your art. gallery showings, convention tables, interact on social media, gather fellow artists around you, social events with drinks and food....basically socialize & talk to people! **as an artist, you need to input love in order to receive love.** . 

step three: when you get an increase in audience and start selling more. Even better, invest your time in larger scale pieces when you do have an audience you can sell to, for higher prices. 


Be patient and pace yourself too! it's important to note that growth that leads to sales, takes a long time to get better overall.

 it is totally okay to approach your work in a casual way, especially if you still have a day job or other full time responsibilities. The thing that matters most is if you enjoy it. if you are showing that you enjoy the process of your growth, people will gravitate to you naturally."
ixp2s8,Reply (Depth 0),"Yeah I don’t go by those comments when pricing my art. It’s usually trial and error! But if people feel really attached to a piece, they are willing to pay for it. Especially if they have been following you through the process of making the piece."
ixp2s8,Reply (Depth 1),"YESS for me it's also trial and error, I still can't find a good way to price my work so I feel like the only ' consistent' way for me to price is just by the way I feel - but still in the bounds of what I think (but I guess it's still my opinion LOL) isn't too steep or too low that i'll feel bad about spending time on it, just to not even be satisfied when I get paid LOLOL

 If you have a dedicated fanbase that will pay you what the art is worth, then you don't even need to listen to these comments at all - you'll get paid by someone who will appreciate your art, and that appreciation and the fact that your customers consider your art WORTH that quality is just so beautiful. I'm tingling just thinking about it LOL"
ixp2s8,Reply (Depth 2),"Exactly! You gotta find that sweet spot, and as you get more popular you can slowly raise prices."
ixp2s8,Reply (Depth 0),"I totally agree with this! Why tell us our art is worth more than what we offer in our commission prices, and then when we consider your praise and decide to fairly up these prices, complain? It makes no sense"
ixp2s8,Reply (Depth 1),"YESS, people fairly argue that these people that ask you to boost your prices are artists, and the people that buy art cheap are just the consumers - but imo some of those people are the same people LOL
 
It's fucking HARD to do right by yourself when your art isn't getting any movement - if almost makes you want to price your work back down, but doing that devalues your work based on someone else's standards.  

I like the comment one user made about keepng your own standards high, and THAT is the way to change yourself from a starving artist to a working artist.

If only those commenters that ask you to price up your work could all be potential buyers LOLOL, I WISH"
ixp2s8,Reply (Depth 0),"https://www.instagram.com/p/CFaN-b9Fser/?igshid=1h3wmn2m2fwjb

Look at how much nixeuu charges for art."
ixp2s8,Reply (Depth 0),"Know your audience as well. Are you marketing to 20-something students or people established in their careers? I couldn’t afford art when I was 20 either, no matter how much I liked it and wanted to support the artist. You are not required to price your art so low that everyone who wants it can buy it."
ixp2s8,Reply (Depth 0),"Most art is *WAY WAY WAY* undervalued.

A professional artist should aim for the production cost of a piece to be no more than 20% of what they sell it for (assuming a dealer or gallery might take 50%). 

I recently charged $9400 for a 60x40"" print which cost me $900 to print/mount and another $1800 to frame. Production ended up \~34% of the sale price. So TIL I'm still charging too little even though it's way more than most people would ever pay for art."
ixp2s8,Reply (Depth 1),"I find it so beautiful that you charged that much - and YEAH THAT'S THE PROBLEM, art costs SO MUCH to ship and frame and print and mount, if I charge my work at exactly the correct price which would be the classic ( skill x time taken x the other thing ) then it would easily be £100+, which sounds so extreme to me. YET people like you and my friend are able to find a way to make it 'work', but even making it ' work'  isn't really fully making it work in terms of comparing how laborious it actually is to the price. 

I'm glad that you make so much though, even though you should be making more. I'm hoping one day you make it so that people will pay the utmost full price for your work."
ixp2s8,Reply (Depth 0),"I mean the hard truth of it is that it's just like any other luxury commodity... you can't make people buy what they don't want to buy for a price they don't want to spend.

If $20 is the most people are willing to spend then you need to find a way to maximize your profits there or find a way to make something people *are* willing to pay more for.

Prints are a great way to maximize profits with higher volume for more affordable prices.

Or if you only want to sell originals and want people to pay more than $20 then you need to offer work they're willing to spend more than $20 on.

That is really all there is to it."
ixp2s8,Reply (Depth 0),"In Mexico we have the same problem, but in ""pesos"", which are worth 20 times less than the dollar. I wish people appreciated art more."
ixp2s8,Reply (Depth 1),"Yeah same, and that sucks - but in your country hopefully everything is priced alright relative to the worth of pesos ):

 I wish everyone appreciated it too - I'm happy that the online generation is embracing the art community though, or at least in my circles :)"
ixp2s8,Reply (Depth 0),"I had someone come up to my table and compliment everything I was selling. Really sucking up. ""It's so good! I'd love to have something! You really deserve money for this!"" They then offered $11 for a piece I was unusually proud of. Turned them down. 

A few hours later I sold that piece for $150."
ixp2s8,Reply (Depth 1),"$11, what an insult. I'm fucking happy for you that you sold it for $150. 

I don't know that guy's situation, but I wouldn't even be able to hold my head up after schmoozing you and THEN OFFERING $11. Maybe he thought that was a lot, but for a piece of art, how embarassing.

3 Redbubble stickers might be $11, not finished piece of art."
ixp2s8,Reply (Depth 2),I was pretty pleased at the end of the day. Me and my mates had a good laugh.
ixp2s8,Reply (Depth 0),"I’ve heard (meaning I haven’t done this because I’m trying to survive in the USA) that selling different things at different price points helps. For example, printed postcards could be cheaper, but large prints and commissions should be priced higher."
ixp2s8,Reply (Depth 0),"I've found explaining the pricing method helps. I do commission only, so it's all custom whatever I make. I say my skilled labor rate, complexity of the piece, materials, and estimated time. Either they realize it's fair pricing, or that they don't actually want something custom. It's served me pretty well, and often I get tipped."
ixp2s8,Reply (Depth 1),"That's fucking cool that it works for you, honestly. 

I tried pricing my art like that, and I just can't imagine me with my current fanbase being able to get anyone to buy it. All my fans are around my age, early 20s, and we all have around the same income, so pricing my work like I read online (and like you described) would make my work like £100+, something that I'd probably need a bigger audience for.

If you don't mind, I have 2 questions

\- how much does your work end up being priced? 

\- Did you start off your art career with just commissions? (because I initially just wanted to do commissions, but I haven't gotten as many customers as I anticipated so I feel like it might be harder to have an only commission career)."
ixp2s8,Reply (Depth 2),"I'd be happy to help! I started out by decking out alot of my own stuff. I'd make stickers, buttons, post my art to facebook, etc. I never made prints, but I guess making custom buttons was my start? Mass producing work always leaves extra unless it's made to order. I'm very green so didn't care for that. I'm a jack of all trades so if someone mentioned ""oh bro that'd be so funny haha I'd love X"" I'd look them dead in the eye and say ""I can make that. You actually interested?"". I got a decent number of commissions that way. I started under priced like everyone else.
If you want to regularly do commission, find your market. I know, easier said than done, but you're basically running a small business. Make business cards, get social media, if you can make decor for your own spaces do it. If I go out I weak my button saying open for commissions, and some other artwork. I pass out cards like candy. I also can read people pretty well. Being observant helps you find your market. If I talk to older people, I show them my charcoal drawings of animals/scenery. If it's people our age, I show them fanart or characters or dumb meme art.

My main source of commission are nerds. I'm wired into Dungeons and Dragons (big money), Magic the Gathering (also can be good), and a few other nerdy hobbies like Gaming. I make stuff for myself like custom art Magic cards and play with those to lure people in. I post on fan groups on twitter or reddit. Facebook is where you get age 30+ commissions frequently.

So my pricing is in USD, so you might need to do a little conversion but ~
If it's just a one medium, one color drawing (like ink and paper) it can range from 20$ -120$.
Charcoals usually are 60$
Custom art Magic cards range from 20- 100$ depending on what all I'm changing.
I made a custom Pip Boy from Fallout, that was a trade but I did the math and it would've been 250$ since it took so long. 

If you want my art accounts you can DM me, or if you've got more questions I'm happy to answer!"
ixp2s8,Reply (Depth 0),Yeah I hate people who want to buy my art for that reason. Over and over I go through that bs. Maybe it’s worth paying someone to sell art.
ixp2s8,Reply (Depth 1),"Isn't it kind of demeaning too? Like you price yourself down, people wanna buy, and you spent hours on a piece only to get like £15 - AND there might be one or 2 people who don't wanna buy, telling you to price up your work, but obviously people are buying your work so WHAT IS IT REALLY WORTH??

I made this post based on a post in hungryartists tbh, this talented artist who could easily charge more is charging less, and hardly any of the comments were telling her to price up, even though I KNOW on a typical day, they would be the ones telling people to price up."
ixp2s8,Reply (Depth 0),Key is to get 50 people to buy a 20 dollar print!
ixp2s8,Reply (Depth 1),Yeah I’m trying to boost my numbers so this will happen
ixp2s8,Reply (Depth 2),"This is different for some people, but having a good community of people you know sorta in person, or at least make a connection with in some way, who are interested in you AND your art. Its about being about your art too, but never a dick to people or taking what some people say about it the wrong way. If you can have some personality people are happy to buy a 20-30 dollar print. Maybe less these days actually, people are not working as much.   
But then you need to do all the business oriented things, like cost of printing and even the cost of networking and being able to get your stuff in front of people. But keep that to material things like gas or food, tickets or w/e just don't think of life as an hourly rate or time sink.  
And then there's the art, you have to be good at it. Keep practicing, but don't burn out. I've always thought art as having perception that others miss and by putting what we perceive into an art work, we show these people the beauty we saw ourselves. It takes skill and practice to express these things, but to capture them you just need to pay attention."
ixp2s8,Reply (Depth 1),"TRUUUUUU, the prints are where it's at."
ixp2s8,Reply (Depth 0),I have issues with this;; I try to price my art fair to me but no one buys until I lower my prices. Especially right now with COVID and everyone having financial stress. Not sure where the happy medium is...
ixp2s8,Reply (Depth 0),"The problem is that some artists charge so little to get their name out their that they're not making any money off the art. Those people generally have another way of making money or are students. 
This is driving prices down and showing non artists that art is cheap. 
It's also incredibly competitive. All people see are pictures on Instagram. Art looks easy, so people assume its easy to do therefore should be cheap. 
It's pretty frustrating."
ixp2s8,Reply (Depth 1),"YESSSSSS, it's so hard to get any commissions when you start (if you don't already have a fanbase) so we've all been there ;;;;;, the naming so low a price so people will actually start buying.

The VERY FIRST CUSTOMER I ALMOST HAD asked me how much it would cost to draw his profile picture on instagram, and I said £12. I thought I named it too low, but he said ' thanks' and never contacted me again LOL. EVEN £12 WAS TOO HIGH.

I had another customer tell me not to sell my art for £30 another time too, and he named £60-£70 for me.

I'm thankful I had a nice customer, but I agree. I said this in another comment - I still think people see art as rudimentary, so they really don't appreciate the time and effort it takes to get the art to a specific level. They probably think if they draw a little more, they can probably get to that same level - but they'll only understand how much work it takes if they try it themselves. 

but I'm glad we have social media and non artists who are part of fandoms that actually appreciate the price of art nowadays, but that's also another part of this - when it's hard to sell art unless it's fanart LOL. That's a different story, but there's such good but bad parts of marketing on social media, there's really no one way to do it which makes it so difficult."
ixp2s8,Reply (Depth 1),"I've encountered idiots over the years that can't equate the effort put into art with actual work. Seriously, some guy literally said art should be free because it's ""just a hobby"" like playing video games, as opposed to ""working"" lol"
ixp2s8,Reply (Depth 2),Wow some people don't understand the concept of labour
ixp2s8,Reply (Depth 1),"I'm not going to blame the students for it, it's just an oversaturated market in general. A lot more supply then demand isn't really anyone's fault, it just means that you have to be an excellent artist/marketer/networker and there isn't much room for more casual or beginning artists anymore. Or you can develop a distinct niche."
ixp2s8,Reply (Depth 2),"It's not about ""blaming"" them exactly. There are a lot of people trying to sell art, and that definitely contributes to it. However, I do partially blame a lack of understanding. Lack of seeing your work as labor. Charging less then minimum wage for a commission is absuive to yourself and contributing to the lowering of prices. It makes it more challenging for people who survive on selling art to compete."
ixp2s8,Reply (Depth 3),"No one would be charging that low if they didn't need the extra money, it wouldn't make sense. I mean, I know I'm underpaid in my day job and my employer undervalues my labor. Doesn't matter, still owe bills."
ixp2s8,Reply (Depth 0),"People want you to do well, just not with their money"
ixp2s8,Reply (Depth 1),It's almost as if wages have stagnated and people can't afford things well. Capitalism wooyea
ixp2s8,Reply (Depth 2),I’m an artist and tbh it would take me a lot to justify spending money on art. Like food? Gas? Entertainment? Vacation? Or art...I like art. I like peoples art. It’s just a luxury that you really need to be motivated to have.
ixp2s8,Reply (Depth 3),"Buying art is also a way of supporting creative people and respecting the amount of time and effort required to do something that isn't immediately ""useful"" or profitable for anyone. 

When we purchase from an artist, there can be a tangible object, event, moment, or information exchanged, but there's also the joy of knowing that you're encouraging them to thrive in their natural state. And the commercial product becomes peripheral."
ixp2s8,Reply (Depth 4),I’m not saying art isn’t worth purchasing but I am saying it’s pretty low on priority lists for costs of living.
ixp2s8,Reply (Depth 5),"Absolutely true. A low priority for most people, which doesn't reflect an absence of appreciation for art but a financial limitation. 

I was adding to your comment, and furthering the content/perspective."
ixp2s8,Reply (Depth 1),☝️
ixp2s8,Reply (Depth 0),Usually it's other artists telling them they are undercharging...but in reality if they don't have good marketing and then they price up they won't get much work at all. It's quite frustrating and really disheartening and kinda annoying
ixp2s8,Reply (Depth 0),"Art is worth as much as the market is ready to pay for it. That's why some invest thousands of dollars into giant canvases with a few colourful strokes made by big name artists, but won't buy an oil painting that took some no-name hundreds of hours to complete. 

The buyer decides the value of your product. It's a hard pill to swallow for many creators, but it is what it is."
ixp2s8,Reply (Depth 1),"It IS what it is. All I can say is that's the truth, and even Van Gogh back then wasn't as popular as he is now. 

It's not only a hard pill to swallow to me, it's also kind of insane.

Is there really a way to value art? You can't exactly measure skill on a scale, time taken doesn't necessarily mean the work is better, and actually, if you practice and become super efficient at doing something - measuring it by time taken penalises you for becoming better at your job. 

It's fucking confusing LOL, but at the same time it's just interesting to think about."
ixp2s8,Reply (Depth 2),"It is a very interesting topic, I agree on that. I think the reason things are  like that is partly because art is very subjective, and is harder to detach from the person behind it than other products. 

And also because technology enable virtually anyone to label themselves an ""artist"", so at the end of the day the supply is bigger than demand, and the general public doesn't perceive art as a serious endeavor, but rather just a play or a phase, or a side gig.

So people who are serious about art have to try extra hard not only to improve skills, but also to prove to everyone that they are indeed serious about art, and are worth of investing in."
ixp2s8,Reply (Depth 3),"Yes yes, it feels like a ' every person is different so everyone has to be judged individually ' sort of thing, but then that brings the question about buyers and who decides which art is worth the most - is it which rich guy spends the most on a piece of art? 

That's true, and there are so many different facets of art and creating - 3D modelling,painting, graphic design,animation, collaging, image manipulation etc. 

I keep labelling it a luxury item because people don't NEED it, but isn't it crazy? This is a whole community of luxury goods creators in a world where imo most people aren't willing to pay for it (unless they're already in the art community and they're supporting eachother). 

The ceiling only gets higher and higher. I've never wanted to quit, but the amount of talent out there is astounding - and I think people especially now are prioritising leisure over working in an office, so more people are learning creative trades in hopes they can turn freelancing into a career. 

Genuinely, I hope everyone can improve and break the ceiling and become successful, but I know that's impossible (at least for the people that give up), so I'll just try my best and hope those who want it really badly will also succeed."
ixp2s8,Reply (Depth 4),"It has always been a luxury, so nothing new there. However, regarding your last point - for every artists that makes it in the industry, there are thousands who give up. Market find the way to regulate itself. It's sad for people who have to settle for smth that doesn't necessarily make them happy, but then.... We also need people in other professions, so it's fair, in my opinion."
ixp2s8,Reply (Depth 0),"Well i get the same and I don’t think you should sell to anybody who undervalues. If they want a different (lower) price it means that they do not value your art for the given price. I don’t think it’s okay to “sell anyway”. YOU give a value to YOUR art. If it’s a commission, you can agree for a price more or less but if it’s a print or your existing art or character I don’t think you should sell for too low. On the other hand people set a price depending on how much value it has for them - but that should only matter for professionals or companies."
ixp2s8,Reply (Depth 0),"I'm a big fan of encouraging prints. If its a commission and under 20, the artist is doing themselves a disservice, but if they are doing these fantastic pieces that could easily be charged at 250$ due to time on it and can't get a buyer, start selling them at 25 a pop. Non-artists don't understand what art takes often and its important for a full time artist to have revenue, especially when their art takes expensive resources to produce."
ixp2s8,Reply (Depth 1),I'm currently looking for on-demand printing services for this exact reason. I'm uncomfortable with ordering a large number of prints and just having them sit around my house in case they don't sell. Would you know of any good places to set that up?
ixp2s8,Reply (Depth 2),"I hesitate about using a print on demand if you have a people looking to buy. You get such a tiny amount back for your buyer to pay a high price. 

There's sites like redbubble and society 6 and Saatchi art but for the ease of uploading, they take the majority of the profits. I have a redbubble but everything is marked up to 50% back , things still sell but in my own shop I can get a lot more in pocket.

You can sell prints in a variety of ways, you can 'print on-demand' 
with a local printshop or online ones offer that too. You'll pay a slightly higher price than if you bought in bulk but you can get so much more back. You can also invest in printing at home . That has a high upfront cost but prints are  0.25 a pop.  

I personally use a site like printful which is a print on demand but I have to set it up myself through a shop. No storage required and it's automated a decent bit but requires more work on your end to get it right."
ixp2s8,Reply (Depth 3),"Yeah, I have Redbubble and the ""profit"" is terrible. 

I do have a good (not professional) quality inkjet printer and I make my own stickers on glossy photo-like sticker paper and they sell pretty well in the store I consign in. I can't really sell prints there because it's a book store, so I'm working on my own site to sell the prints there. But ink is so expensive, I don't think it'd be worth it to print my prints, plus I don't think off-the-shelf ink is archival.

I'll check out Printful. I think I've used them before, but it's been a while. Thanks."
